[{"id":"fx-back_line_change-away-ev-001484-to-t4671-00","name":"back_line_change(away, ev-001484, to t4671.00)","value":9.0,"unit":"m","display":{"en":["9 m","9 metres"],"es":["9 m"]},"scope":{"side":"away","t_from":2871.19,"t_to":4671.0},"source_ids":["agg-before_ev_001484","agg-since_ev_001484_to_t4671_00","ev-001484"],"extractor":{"name":"since","version":"1"},"label":"Ashford Vale back line dropped deeper since the red card (63′), to 77:51 (size of the change)"},{"id":"fx-back_line_height-away-before-ev-001484","name":"back_line_height(away, before ev-001484)","value":34.3,"unit":"m","display":{"en":["34 m","34 metres"],"es":["34 m"]},"scope":{"side":"away","t_from":2871.19,"t_to":3771.19},"source_ids":["agg-before_ev_001484","ev-001484"],"extractor":{"name":"since","version":"1"},"label":"Ashford Vale back line, before the red card (63′)"},{"id":"fx-card-ev-001479-kind","name":"card(ev-001479).kind","value":"yellow","display":{"en":["yellow"],"es":["yellow"]},"scope":{"side":"away","t_from":3736.49,"t_to":3736.49},"source_ids":["ev-001479"],"extractor":{"name":"extract_discipline","version":"1"},"label":"Okafor-Lind, yellow card"},{"id":"fx-card-ev-001479-minute","name":"card(ev-001479).minute","value":63,"display":{"en":["63′"],"es":["63′"]},"scope":{"side":"away","t_from":3736.49,"t_to":3736.49},"source_ids":["ev-001479"],"extractor":{"name":"extract_discipline","version":"1"},"label":"minute of the card"},{"id":"fx-card-ev-001479-player","name":"card(ev-001479).player","value":"Okafor-Lind","display":{"en":["Okafor-Lind"],"es":["Okafor-Lind"]},"scope":{"side":"away","t_from":3736.49,"t_to":3736.49},"source_ids":["ev-001479"],"extractor":{"name":"extract_discipline","version":"1"},"label":"player shown the card"},{"id":"fx-card-ev-001479-players_after","name":"card(ev-001479).players_after","value":11,"unit":"count","display":{"en":["11"],"es":["11"]},"scope":{"side":"away","t_from":3736.49,"t_to":3736.49},"source_ids":["ev-001479"],"extractor":{"name":"extract_discipline","version":"1"},"label":"players left after the card"},{"id":"fx-cards-away-match","name":"cards(away, match)","value":2,"unit":"count","display":{"en":["2"],"es":["2"]},"scope":{"side":"away","t_from":0.0,"t_to":5884.3},"source_ids":["win-01","win-02","win-03","win-04","win-05","win-06"],"extractor":{"name":"extract_events","version":"1"},"label":"Ashford Vale cards, over the match"},{"id":"fx-compactness-away-before-ev-001484","name":"compactness(away, before ev-001484)","value":933.795,"unit":"m2","display":{"en":["934 m²","934 square metres"],"es":["934 m²","934 metros cuadrados"]},"scope":{"side":"away","t_from":2871.19,"t_to":3771.19},"source_ids":["agg-before_ev_001484","ev-001484"],"extractor":{"name":"since","version":"1"},"label":"Ashford Vale shape (area covered, smaller is tighter), before the red card (63′)"},{"id":"fx-compactness_change-away-ev-001484-to-t4671-00","name":"compactness_change(away, ev-001484, to t4671.00)","value":179.0,"unit":"m2","display":{"en":["179 m²","179 square metres"],"es":["179 m²","179 metros cuadrados"]},"scope":{"side":"away","t_from":2871.19,"t_to":4671.0},"source_ids":["agg-before_ev_001484","agg-since_ev_001484_to_t4671_00","ev-001484"],"extractor":{"name":"since","version":"1"},"label":"Ashford Vale shape tightened up since the red card (63′), to 77:51 (size of the change)"},{"id":"fx-corners-away-match","name":"corners(away, match)","value":8,"unit":"count","display":{"en":["8"],"es":["8"]},"scope":{"side":"away","t_from":0.0,"t_to":5884.3},"source_ids":["win-01","win-02","win-03","win-04","win-05","win-06"],"extractor":{"name":"extract_events","version":"1"},"label":"Ashford Vale corners, over the match"},{"id":"fx-field_tilt-away-match","name":"field_tilt(away, match)","value":0.4935,"unit":"pct","display":{"en":["49%","49 per cent"],"es":["49 %"]},"scope":{"side":"away","t_from":0.0,"t_to":5884.3},"source_ids":["win-01","win-02","win-03","win-04","win-05","win-06"],"extractor":{"name":"extract_events","version":"1"},"label":"Ashford Vale share of play near the opposition goal, over the match"},{"id":"fx-fouls-away-match","name":"fouls(away, match)","value":11,"unit":"count","display":{"en":["11"],"es":["11"]},"scope":{"side":"away","t_from":0.0,"t_to":5884.3},"source_ids":["win-01","win-02","win-03","win-04","win-05","win-06"],"extractor":{"name":"extract_events","version":"1"},"label":"Ashford Vale fouls, over the match"},{"id":"fx-freeze_frame-ev-000003-attackers_ahead_of_ball","name":"freeze_frame(ev-000003).attackers_ahead_of_ball","value":4,"unit":"count","display":{"en":["4"],"es":["4"]},"scope":{"side":"home","t_from":2.74,"t_to":2.74},"source_ids":["ev-000003","ff-000003"],"extractor":{"name":"extract_freeze_frames","version":"1"},"label":"attackers ahead of the ball"},{"id":"fx-freeze_frame-ev-000003-attackers_v_defenders","name":"freeze_frame(ev-000003).attackers_v_defenders","value":"3 v 9","display":{"en":["3 v 9"],"es":["3 v 9"]},"scope":{"side":"home","t_from":2.74,"t_to":2.74},"source_ids":["ev-000003","ff-000003"],"extractor":{"name":"extract_freeze_frames","version":"1"},"label":"attackers against defenders near the ball"},{"id":"fx-freeze_frame-ev-000003-away_ahead_of_ball","name":"freeze_frame(ev-000003).away_ahead_of_ball","value":1,"unit":"count","display":{"en":["1"],"es":["1"]},"scope":{"side":"home","t_from":2.74,"t_to":2.74},"source_ids":["ev-000003","ff-000003"],"extractor":{"name":"extract_freeze_frames","version":"1"},"label":"Ashford Vale players ahead of the ball"},{"id":"fx-freeze_frame-ev-000003-defenders_between_ball_and_goal","name":"freeze_frame(ev-000003).defenders_between_ball_and_goal","value":1,"unit":"count","display":{"en":["1"],"es":["1"]},"scope":{"side":"home","t_from":2.74,"t_to":2.74},"source_ids":["ev-000003","ff-000003"],"extractor":{"name":"extract_freeze_frames","version":"1"},"label":"defenders between the ball and goal"},{"id":"fx-freeze_frame-ev-000003-defenders_drawn","name":"freeze_frame(ev-000003).defenders_drawn","value":0,"unit":"count","display":{"en":["0"],"es":["0"]},"scope":{"side":"home","t_from":2.74,"t_to":2.74},"source_ids":["ev-000003","ff-000003"],"extractor":{"name":"extract_freeze_frames","version":"1"},"label":"defenders pulled towards the ball"},{"id":"fx-freeze_frame-ev-000003-home_ahead_of_ball","name":"freeze_frame(ev-000003).home_ahead_of_ball","value":4,"unit":"count","display":{"en":["4"],"es":["4"]},"scope":{"side":"home","t_from":2.74,"t_to":2.74},"source_ids":["ev-000003","ff-000003"],"extractor":{"name":"extract_freeze_frames","version":"1"},"label":"Rivermouth players ahead of the ball"},{"id":"fx-freeze_frame-ev-000009-players_bypassed","name":"freeze_frame(ev-000009).players_bypassed","value":0,"unit":"count","display":{"en":["0"],"es":["0"]},"scope":{"side":"away","t_from":15.69,"t_to":15.69},"source_ids":["ev-000009","ff-000009"],"extractor":{"name":"extract_freeze_frames","version":"1"},"label":"opponents bypassed by the pass"},{"id":"fx-freeze_frame-ev-000222-shooter_nearest_defender","name":"freeze_frame(ev-000222).shooter_nearest_defender","value":15.4638,"unit":"m","display":{"en":["15 m","15 metres"],"es":["15 m"]},"scope":{"side":"away","t_from":514.46,"t_to":514.46},"source_ids":["ev-000222","ff-000222"],"extractor":{"name":"extract_freeze_frames","version":"1"},"label":"distance to the shooter's nearest defender"},{"id":"fx-freeze_frame-ev-000003-zone_attackers","name":"freeze_frame(ev-000003).zone_attackers","value":3,"unit":"count","display":{"en":["3"],"es":["3"]},"scope":{"side":"home","t_from":2.74,"t_to":2.74},"source_ids":["ev-000003","ff-000003"],"extractor":{"name":"extract_freeze_frames","version":"1"},"label":"attackers in the shooting area"},{"id":"fx-freeze_frame-ev-000003-zone_defenders","name":"freeze_frame(ev-000003).zone_defenders","value":9,"unit":"count","display":{"en":["9"],"es":["9"]},"scope":{"side":"home","t_from":2.74,"t_to":2.74},"source_ids":["ev-000003","ff-000003"],"extractor":{"name":"extract_freeze_frames","version":"1"},"label":"defenders in the shooting area"},{"id":"fx-goals-away-match","name":"goals(away, match)","value":0,"unit":"count","display":{"en":["0"],"es":["0"]},"scope":{"side":"away","t_from":0.0,"t_to":5884.3},"source_ids":["win-01","win-02","win-03","win-04","win-05","win-06"],"extractor":{"name":"extract_events","version":"1"},"label":"Ashford Vale goals, over the match"},{"id":"fx-high_turnovers-away-before-ev-001484","name":"high_turnovers(away, before ev-001484)","value":0,"unit":"count","display":{"en":["0"],"es":["0"]},"scope":{"side":"away","t_from":2871.19,"t_to":3771.19},"source_ids":["agg-before_ev_001484","ev-001484"],"extractor":{"name":"since","version":"1"},"label":"Ashford Vale high turnovers (ball won high up the pitch), before the red card (63′)"},{"id":"fx-lead-ev-001670","name":"lead(ev-001670)","value":"Rivermouth lead","display":{"en":["Rivermouth lead"],"es":["Rivermouth lead"]},"scope":{"side":"home","t_from":4228.05,"t_to":4228.05},"source_ids":["ev-001670"],"extractor":{"name":"extract_score","version":"1"},"label":"who leads"},{"id":"fx-line_breaking_passes-away-before-ev-001484","name":"line_breaking_passes(away, before ev-001484)","value":1,"unit":"count","display":{"en":["1"],"es":["1"]},"scope":{"side":"away","t_from":2871.19,"t_to":3771.19},"source_ids":["agg-before_ev_001484","ev-001484"],"extractor":{"name":"since","version":"1"},"label":"Ashford Vale passes through the lines, before the red card (63′)"},{"id":"fx-line_gap-away-match-in_possession","name":"line_gap(away, match, in_possession)","value":28.825,"unit":"m","display":{"en":["29 m","29 metres"],"es":["29 m"]},"scope":{"side":"away","t_from":0.0,"t_to":5884.3},"source_ids":["agg-position_samples","win-01","win-02","win-03","win-04","win-05","win-06"],"extractor":{"name":"extract_positions","version":"1"},"label":"Ashford Vale gap between the lines with the ball, over the match"},{"id":"fx-momentum-min-01","name":"momentum(min-01)","value":-24.0,"unit":